livre.chapitre.verset,Bafia
JHN.1.1,"A rìtumɛ̀n, Jɛ̀ɛ̀ ì ɓaghà, nni Jɛ̀ɛ̀ ì ɓaghà ɓɛɛ̀ Bɛ̀ll, Jɛ̀ɛ̀ ì ki ɓaghà Bɛ̀ll. "
JHN.1.2,I ɓaghà ɓɛɛ̀ Bɛ̀ll a rìtumɛ̀n. 
JHN.1.3,"Jɛ̀ɛ̀ ìnɛn yɛ̀ɛ kighà ɓyom ɓìcèm, nni ɓi ɓyom ɓi ɓi kilɛ̀ngà, kidɛŋ ki kilɛ̀ngà ɓi kɛ̀ɛ̀ yɔ̀. "
JHN.1.4,"Cɛɓ ki ɓaghà ɓi Jɛ̀ɛ̀ ìnɛn, cɛɓ kìn ki ki fafa ɓum kìtɛɛtɛn. "
JHN.1.5,"Kìtɛɛtɛn ki lomlòm ɓi birìm, birìm yɛ̀ kɛɛ̀ ki teɗ kɔ. "
JHN.1.6,Bɛ̀ll à romgày ŋwaàdɛŋ ɗii lɛ Zyaŋ. 
JHN.1.7,Nnyɛɛ yughày fɛlɛ yɛ̀ɛ wusìnɛ̀ɗ à kìtɛɛtɛn lɛ di ɓum ɓɛɛ gherɛn lɛ rìkpaa ɗii. 
JHN.1.8,"Nyii ɓaghà ɓi kitɛɛtɛn, kìɓan kifog à yùghày lɛ a kpaà ɓum kìɓan ki kitɛɛtɛn. "
JHN.1.9,"Jɛ̀ɛ̀ ìnɛn ì ɓaghà kɔɔ̀kɔɔ̀ à kìtɛɛtɛn, ki ki yughà ɓi ziinɛ lɛ kɛɛ kpeŋzi ɓum ɓɛ̀cèm. "
JHN.1.10,"Jɛ̀ɛ̀ ì ɓaghà ɓi ziinɛ, yɛ̀ɛ ki kìghà ziinɛ, wɔ̀lɛ ziinɛ ì yitìghà ɓi yɔ̀. "
JHN.1.11,"Ì yughà a ɓum ɓii, ɓum ɓii ɓɛ̀ kɛɛ̀ ki ghàɓ yɔ̀; "
JHN.1.12,"wɔ̀lɛ ì faghà ɓum ɓɛ̀cèm ɓɛ ɓɛ ghaɓkà kɔ, ɓɛ gherɛ̀n ɗii ɗi yɔ̀, ìtèɗ wulɛ ɓɛɛ ɓa ɓɔn ɓɛ Bɛ̀ll. "
JHN.1.13,"Ɓumɓɛ̀n ɓɛ ghalà ɓi ɓɔn ɓɛ Bɛ̀ll rì nyoo ì mɛ̀mùù fɛlɛ yɛ̀ɛ ɓɔn ɓɛ ɓum ɓɛɛ̀ yalàg, lɔŋ Bɛ̀ll yɛɛ faghà ɓɔ cɛɓ ki nyɔn."
JHN.1.14,"Fɔɔnnɛ jɛ̀ɛ̀ ì ghalà mum ànɛ à ghɛɓkà ɓi nyìinyìm wìs, ǹɗonɛn, rì geesɛ̀n, rì saaɗ, tì ki ghɛngà rìkem ɗii, rìkem ɗìn ɗi ki ɓa ɗi mbobog à Man ànɛ à pɛ̀sɛ̀ngày yɛ̀ɛ Seŋì. "
JHN.1.15,"Zyaŋ à rɛlìghà wusìnɛ̀ɗ ànɛ ɓi kìɓan kii, à làmɓɛ̀n lɛ: Nnyɛɛ ri ŋwaànɛ ǹkpaaghà mìni lɛ: Roànɛ à rìì mɛ̀ ajɛ̀m, à lokày rì mɛ̀, ɓisuulɛ nyii ɓaghà di mɛ̀ ǹka yin. "
JHN.1.16,"Ɓìsiìcèm tì mɛ teɗ ɓɛmààgh ɓɛ ɓi rìɓa ɗii ɗi à rì ǹɗonɛn, à saàsàgtàg ɓìsi geesɛ̀n. "
JHN.1.17,"Ɓisuulɛ, ɓìdɔ̀gsɛna ɓi falɛ̀ngà rì Moyis, geesɛ̀n rì saaɗ ɓi yuiy rì Yeesus Kiris. "
JHN.1.18,"Mum à ka ghɛngà ɓi Bɛ̀ll, lɔŋ m̀bobog à Man à Bɛ̀ll ànɛ à rì jàŋbog rì Seŋi yɛɛ kighà lɛ ɓɛɛ yi nyi."
JHN.1.19,Fɛlɛ nnɛ Zyaŋ à kpaaghà yɛ̀ɛ Ɓɛ̀yudɛ̀n ɓɛ a Yorisalɛm ɓɛ romgày ɓɛ̀pìrɛɛtìrɛ̀ rì ɓɛ̀levìt lɛ ɓɛɛ tɔg nyi lɛ: Wɔ̀ɔ̀ rì ghɛn? 
JHN.1.20,"À gherɛ̀ngà kɛ̀ɛ pwàà, à gherɛ̀n, à kpaa lɛ: Mɛ̀ ǹ-yin Kiris."
JHN.1.21,Nni ɓɛ tɔkà nyi lɛ: Wɔ̀ɔ̀ rì min ghɛn? Wɔ̀ yɛɛ ri Eli gìn? Zyaŋ à ɓàg lɛ: Èe èe. Ù rì ǹkpaŋzì-ɓìɓan anɛ̀n?  Zyaŋ lɛ: Àg. 
JHN.1.22,Fɔɔnnɛ ɓɛ tɔkà nyi lɛ: Wɔ̀ɔ̀ ki rì min ghɛn? Tì ghɛ̀ɛ̀sɛɛ kì sugtii ki kpaà ɓumɓɛ ɓaa romiì ɓìsi rìɓàg. Wɛ̀ɛmiɗ kali ɓìsi! Wɔ̀ɔ̀ rì ghɛn? 
JHN.1.23,"Nni Zyaŋ à ɓàkà lɛ: Mɛ̀ ǹɗì jɛ̀ɛ̀ ì roànɛ a làalam̀ɓɛ̀n ɓi-reɓ lɛ pègsɛɛna bee ì Kan, lɔŋ yɛ̀ɛ ǹkpaŋzì-ɓìɓan Ezayii à kpaaghà."
JHN.1.24,"Ɓumɓɛ ɓɛ romgày ɓɛǹ yɛ̀ɛ Zyaŋ, ɓɛ ɓaghà Ɓɛ̀fàrìzyɛŋ. "
JHN.1.25,"Nni ɓɛ tɔgtìghà nyi lɛ: I wɔ̀ ki yin Kiris, nsoò lɛ Eli, nsoò ǹkpaŋzì-ɓìɓan, ɓisuucɛ nnɛ u ɓàaɓaɓtì ɓum? Zyaŋ à ɓàg ɓɔ lɛ: "
JHN.1.26,"Mɛ̀ɛ mɓàaɓaɓtì ɓum rì mɛ̀nig, kìɓan kifog ŋwaàdɛŋ à rì foo ɓi nyìinyìm wìn, ànɛ ɓì yii ɓi; nyi yɛɛ riì mɛ̀ ajɛ̀m. "
JHN.1.27,Mɛ̀ ǹwuɓsɛɛ gì ɓi nkoŋ wulɛ ǹfùmì ǹɗig wii wu gòò.
JHN.1.28,"Ɓìɓan ɓiǹ ɓi kilɛ̀ngà a Bɛtanii, cɛcɛɗ ki Zyuridɛŋ, ɓi jàŋ inɛ Zyaŋ à ɓààɓàɓtìghà ɓum."
JHN.1.29,"Ɓi duri tana, Zyaŋ à ghɛngà di Yeesus à tiì a lɔ̀ŋkii, à kpaa lɛ man à jɔ̀ɔ̀ à Bɛ̀ll ànɛ a pipisi kiɓe ki ɓum ɓi ziinɛ yɛɛ ri lɛ. "
JHN.1.30,"Nnyɛɛ ri roànɛ mɛ̀ɛ ǹkpaa lɛ ŋwaàdɛŋ à rìì mɛ̀ ajɛ̀m, à lokày mɛ̀ beèbɛ̀y, ɓisuulɛ nyii ɓaghà di mɛ̀ ǹka yin. "
JHN.1.31,"Mɛ̀ ǹ-yighà ɓi nyi, kìɓan kifog, ǹ-yùghày lɛ mɓaɓti ɓum rì mɛ̀nig, lɛ di Isirayɛl àa yii nyi. "
JHN.1.32,"Zyaŋ à kpaatìghà lɛ ǹghɛngà di Ǹghay a sɛnsɛn yi aɗyoo yɛ̀ɛ kuùkuù, à yù nyi kì ɓɛ̀lii ɓi nyòò. "
JHN.1.33,"Mɛ̀ ǹ-yighà ɓi nyi, wɔ̀lɛ roànɛ à romgày mɛ̀ lɛ mɓààɓàɓtì ɓum rì mɛ̀nig, à kpaaghà mɛ̀ lɛ: Ŋwaànɛ ù rì ɓiì ghɛɛ̀ di Ǹghay à sɛniì, ɓi nyoo à rɔ̀ɓ ɓi nyi, roànɛ̀n yɛɛ ɓiì ɓàɓtii ɓum rì Kìtɛntɛ̀ɛ̀n ki Nghay. "
JHN.1.34,"Mɛ̀ ǹghɛngà kìɓan kiǹ, fɔɔnnɛ ǹkpaaghà miì lɛ, nnyɛɛ ri Man à Bɛ̀ll."
JHN.1.35,"Ɓi duri tana, Zyaŋ à ɓaghà di à kaka wɔɔ ri ɓɛ̀yilàg ɓii ɓɛdɛŋ ɓɛɓɛɛ̀. "
JHN.1.36,"Yɛ̀ɛ à ghɛngà di Yeesus a ghaghààgh, nni à kpaaghà lɛ: Man à jɔ̀ɔ̀ à Bɛ̀ll innɛ. "
JHN.1.37,"Kìɓɛ̀ɛ̀ kii ki ɓɛyilàg ki wokà com ki à kpaaghà, ki ki nɔ̀ɔ̀ti Yeesus. "
JHN.1.38,"Yɛ̀ɛ Yeesus à lɔ̀ɔ̀ghrɛ̀ngày, à ghɛn lɛ ɓɛɛ̀ nɔ̀ɔnɔɔ̀tìì nyi, nni à tɔkà ɓɔ lɛ: Cɛ ɓi kaakàà? Ɓɛ̀roɓɛ̀n ɓɛ kpaa nyi lɛ: Raɓì, yɛɛ lɔɔ lɛ ǹɗèsàg, fennɛ ù kɔ̀kɔrii? "
JHN.1.39,"Yeesus à kpaa ɓɔ lɛ: Yùunay, di ɓi ghɛǹ. Nni ɓɛ kɛǹgà ɓɛ ghɛn jàŋ inɛ à kɔ̀kɔ̀rìghà, ɓɛ ratɛ̀n kì ghagsii ŋwos anɛ̀n ri nyi, ki ɓaghà nunùg mɛ̀kɛ̀ɛ̀ mɛnin à ŋwos nkɛ̀nɛn."
JHN.1.40,"Andire à geni Simɔn Pyɛɛri à ɓaghà kìbog ki ɓi ɓum ɓɛ kiɓɛ̀ɛ̀ ɓɛ ɓɛ wokà kìɓan ki Zyaŋ à kpaaghà, ɓɛ nɔɔ̀tì Yeesus. "
JHN.1.41,"Andire ànɛn à lokà kì tanɛɛ ri Simɔn à geni, à kpaa nyi lɛ: Tyàa ghɛɛ Mèsii, yɛɛ lɔɔ lɛ Kiris. "
JHN.1.42,"Fɔɔnnɛ à syògà Simɔn yɛ̀ɛ Yeesus. Yeesus à fiɓì nyi à kpaa lɛ: Simɔn, man à Zyonas ɓɛ ri wɔ̀ ɓiì reŋɗaagh lɛ Sefas, yɛɛ lɔɔ lɛ Pyɛɛri ."
JHN.1.43,"Ɓi duri tana Yeesus à ɓekà lɛ a kɛǹ a Galile, nni à tanɛ̀ngà Filiɓ à kpaa nyi lɛ: Nɔ̀ɔ̀ti mɛ̀. "
JHN.1.44,"Filiɓ à ɓaghà ŋwaànɛ a Bɛdsayida, ɓi bàn ì ɓɛ̀-Andire ɓɛɛ̀ Pyɛɛri."
JHN.1.45,"Fɔɔnnɛ Filiɓ à tuusɛ̀ngà rì Natanayɛl, à kpaa nyi lɛ: Tyàa ghɛɛ ŋwaànɛ kìɓan kii ki ri kìkànɛn ɓi kaàtà à ɓìdɔ̀gsɛna ɓi Moyis rì ɓi ɓɛ̀kaàtà ɓɛ ɓɛkpaŋzì-ɓìɓan, nnyɛɛ ri Yeesus à man à Yoosɛɓ ànɛ a Naazarɛt. "
JHN.1.46,Nni Natanayɛl à kpaaghà Filiɓ lɛ: Cɛ ki cem kɛɛ ri lɛ ki kpaŋ yì a Naazarɛt? Fɔɔnnɛ Filiɓ à kpaaghà nyi lɛ: Yuiy u ghɛǹ. 
JHN.1.47,Yɛ̀ɛ Yeesus à ghɛngà di Natanayɛl a yùyuiy nyi a nyoo nni à kpaaghà lɛ: Natanayɛl à rì kɔɔ̀kɔɔ̀ à muu Isirayɛl ànɛ à yin ɗi mɛ̀ɗyɔg. 
JHN.1.48,"Nni Natanayɛl à tɔkà Yeesus lɛ: Wɔ̀ɔ̀ yii mɛ̀ fe? Yeesus à pɛ̀ɛ̀zì nyi lɛ: Màa ghɛɛ wɔ̀ cààmɛ̀n ki wàa rì a nɗyèm wu fìgyee zi, di Filiɓ à ka reŋii ɓi wɔ. "
JHN.1.49,"Fɔɔnnɛ Natanayɛl à kpaaghà min Yeesus lɛ: Raɓì, ù rì Man à Bɛ̀ll, ù rì rìfòm ɗi Isirayɛl. "
JHN.1.50,"Yeesus à bàg nyi lɛ: Yɛ̀ɛ ǹkalii wɔ̀ lɛ màa ghɛɛ wɔ̀ a nɗyèm wu fìgyee zi, nnɛ ù gherɛɛ, ù rì ɓiì ki ghɛɛ̀ ɓìɓan ɓidɛŋ ɓi ɓi teghɛɛ ɓi cee fɔlɔɔ. "
JHN.1.51,"Ǹkalii mìni kɔɔ̀kɔɔ̀ à rìkpaa lɛ, ɓì rì ɓiì ghɛɛ̀ di ɗyoo ɗi nɛmɓɛɛ, ɓum ɓɛ titom ɓɛ Bɛ̀ll ɓɛ ɓɔɓɔ̀g ɓɛ sɛnsɛ̀n Man à mum a nto."
JHN.2.1,"Ajɛ̀m ì mɛ̀ru mɛraa, kìsɛ̀nɛ̀ ki riwɛy ki ɓaghà a Kana, ɓi zi ì Galile, jɛɛ Yeesus à ɓaghà wɔɔ. "
JHN.2.2,Ɓɛ reŋìghà girig Yeesus rì ɓɛ̀yilàg ɓii a kìsɛ̀nɛ̀ kiǹ. 
JHN.2.3,"Yɛ̀ɛ mɛ̀rɔ̀g mɛ lekà, nni jɛɛ Yeesus à kpaaghà nyi lɛ: Ɓɛ yiìdi ri mɛ̀rɔ̀g. "
JHN.2.4,"Yeesus à ɓàg nyi lɛ: Giɓ anɛ, cɛ kɛɛ ri lɛ rì mɛ̀ rì wɔ̀? Cààmɛ̀n kɛm̀ ki ka kpaŋ ɓi. "
JHN.2.5,Jɛɛ à kpaa ɓɛ̀kìì-ɓìsay lɛ: Kìina com kìcèm ki à rì mìni ɓiì kalii. 
JHN.2.6,"Bèè yi mɛnig yi yi ɓaghà yì yèŋɛn ɗi gɔ̀g, yi ɓaghà wɔɔ taàfog; bèè yiǹ yi ɓaghà foo lɛ, yɛɛ ghɛɓsi ɓisuu ɓisyɔ̀ɔ̀ ɓi ritɛn ɓi ɓi rìgherɛ̀n ɗi Ɓɛ̀yudɛ̀n; bog ì ɓaghà lɛ ì kpaŋ ɓɛ̀kpɛm  ɓɛɓɛɛ̀ nsoò lɛ ɓɛraa. "
JHN.2.7,"Yeesus à kpaa ɓɔ lɛ: Roòziina mɛ̀nig ɓi bèè yi, fɔɔnnɛ ɓɛ roòzàkà mɛ̀nig miì, lɛ pisa. "
JHN.2.8,"Yeesus à kpaa ɓɔ lɛ: Ɓɔ̀rina min mɔ, ɓi kɛǹ kì faà ǹkɛ̀ɛ̀sì-ɓìɓan ɓi kisɛ̀nɛ̀. Fɔɔnnɛ ɓɛ kɛngà nyi rì mɔ. "
JHN.2.9,"Yɛ̀ɛ ǹkɛ̀ɛ̀sì-kìsɛ̀nɛ̀ à ɓoɓtìghà mɛ̀nig mɛ mɛ ɓaghà mɛǹ di maa ghay mɛrɔ̀g, kɛ̀ɛ yi jàŋ inɛ mɛ̀rɔ̀g mɛǹ mɛ ɓaa yì, kɔm̀ lɛ ɓɛ̀kìì-ɓìsay ɓɛ ɓɛ ɓwɛɗkày mɛ̀nig ɓɔɔ yighà. "
JHN.2.10,"Fɔɔnnɛ à reŋìghà ŋwaànɛ à wɔlɛ̀ngà à kpaa nyi lɛ: Ɓɛ̀ro ɓɛɛ̀ loki kìfaà ɓɛ̀kèn mɛrɔ̀g mɛ syeesyee, ɓɛ siitɛ̀n ɓɔ kìfaà mɛ ɓeɓtɛn di ɓaa ŋwagì; kìɓan kifog wɔ̀ wàa ɓèŋɓeŋi mɛ̀rɔ̀g mɛ syeesyee à kpaŋ ɓigomìnɛ."
JHN.2.11,"Fɔlɔɔ nnɛ Yeesus à kìghà dàm yìì i ǹtonto a Kana, ɓi zi ì Galile, à rèsì rìgwey ɗii, ɓɛ̀yilàg ɓii ɓɛ ki gherɛn nyi."
JHN.2.12,"Ajɛ̀m ìnɛn, nnɛ à sɛngà a Kapɛrinawum ǹɗaŋ ri jɛɛ, rì ɓɛ̀geni, rì ɓɛ̀yilàg ɓii, ɓɛ ghagsì lɔŋ ɓɔɔ mɛru wɔɔ lɛsàg."
JHN.2.13,"Yɛ̀ɛ tìcàɓ ti Ɓɛ̀yudɛ̀n ti lɛ Paskà ti kɛɛkɛ̀ɛ̀ghày, nni Yeesus à ɓɔkà a Yorisalɛm. "
JHN.2.14,"À tanɛ̀n di ɓɛ ri ɓi naà-Bɛ̀ll lɛ rì ɓɛ̀kàɓì sanìnya, rì ɓɛ̀kàɓì bwiy, rì ɓɛ̀kàɓì ɓɛ̀kuùkuù, rì ɓumɓɛ ceeceǹɗìyɛ̀n ɓum mɔ̀ɔ̀ni. "
JHN.2.15,"Yɛ̀ɛ à kìlɛ̀ngà ǹkpas rì ɓìsɔŋ, nni à nàɓkà ɓɔ ɓɛ̀sɛ̀ɛ̀ ɓɛ̀cèm ɓi naà-Bɛ̀ll, à nàɓkì girig lɛ rì bwiy yaa, rì ɓɛ̀sanìnya ɓaa; à tyàŋzì mɔ̀ɔ̀ni mɛ ɓumɓɛ ɓɛ ceècèǹɗìghà ɓum mɔ̀ɔ̀ni, à tyɔkì ɓɛ̀teɓèrè ɓaa; "
JHN.2.16,à ki kpaa ɓɛ̀kàɓì ɓɛ̀kuùkuù lɛ: Pisiina ɓyom ɓi fɛ! Kɛ̀ ɓi ghaasi naa ì Seŋi wɛ̀m mɛɛ mɛ fyèè. 
JHN.2.17,Nni Ɓɛ̀yilàg ɓii ɓɛ yitìghà lɛ ki ri kì kànɛn lɛ: Ǹkɔ̀nɛ̀n à naa yɔ̀ɔ̀ à ɓuni mɛ̀ ǹɗem.
JHN.2.18,"Ɓɛ̀yudɛ̀n ɓɛ tekà jɛ̀ɛ̀ ɓɛ tɔg nyi lɛ: Dàm ì be yɛɛ̀nɛ ù rì lɛ ù kì, lɛ u resi ɓìsi lɛ, ù rì rì ìtèɗ wulɛ u ki yɛ̀ɛ ù kìi yì lɔɔ? "
JHN.2.19,Yeesus à ɓàg ɓɔ lɛ: Wààghiina na-Bɛ̀ll ìnɛ mpɛɛ̀zi yɔ̀ ki toŋì ɓi mɛ̀ru mɛraa. 
JHN.2.20,"Ɓɛ̀yudɛ̀n ɓɛ pɛɛ̀zì nyi lɛ: Naà-Bɛ̀ll ìnɛ ɓɛ togà bèg mɛ̀tin mɛɓɛɛ̀ rì bèg taàfog, yɛɛ̀nɛ wɔ̀ɔ̀ rì ɓiì pɛ̀ɛ̀zii kitoŋì ɓi mɛ̀ru mɛraa? "
JHN.2.21,"Wɔ̀lɛ naà-Bɛ̀ll ìnɛ Yeesus à kalìghà, ì ɓaghà nyoo yìì. "
JHN.2.22,"Yɛ̀ɛ à ghèmɓɛ̀ngày a nyɔ̀ɛ̀y, ɓɛ̀yilàg ɓii ɓɛ yitì lɛ à kpaaghà fɔlɔɔ, fɔɔnnɛ ɓɛ gherɛ̀ngà ɓìɓan ɓi ɓi ri ɓì kànɛn, ɓɛ ki gherɛn ti kìɓan ki Yeesus à kpaaghà kiǹ."
JHN.2.23,"Cààmɛ̀n ki Yeesus à ɓaghà a tìcàɓ ti a Paskà Yorisalɛm, ɓum lɛɛ̀gwey ɓɛ gherɛ̀ngà nyi, yɛ̀ɛ ɓɛ ghɛngà dàm yi ɓiɓan yi à kìkìghà. "
JHN.2.24,"Wɔ̀lɛ Yeesus à tyweeyàkà ɓi ɓɔ ɓisuulɛ, à yighà ɓɔ ɓɛ̀sɛ̀ɛ̀ ɓɛ̀cèm, "
JHN.2.25,"rì tì lɛ, ki ghɛɓsìghà ɓi nyi com lɛ ɓɛɛ ka rèsi nyi rìɓa ɗi mum, lɛ nyimiɗ a yighà com ki mum a fèfeg ɓi ǹɗem ɓi ɗùm."
JHN.3.1,"Nni ŋwaàdɛŋ ànɛ ɓi nɗaŋ wu Ɓɛ̀fàrìzyɛŋ ɗii lɛ Nikodɛm, à ɓaghà kìbog ki ɓi ɓɛ̀lem ɓɛ ɓum ɓɛ Ɓɛ̀yudɛ̀n, "
JHN.3.2,"à yùghà yɛ̀ɛ Yeesus rì ìru à kpaa nyi lɛ: Raɓì, tì yii lɛ, ù rì ǹɗèsàg ànɛ Bɛ̀ll yɛɛ romiì ɓisuulɛ, ŋwaà yin lɛ à kì dàm yi ɓiɓan yɛ̀ɛ yi wɔ̀ɔ kìki yi, di Bɛ̀ll à yin a lɔ̀ŋkii. "
JHN.3.3,"Nni Yeesus à ɓàkà nyi lɛ: Ǹkpaa wɔ̀ kɔɔ̀kɔɔ̀ à rìkpaa lɛ, i mum à yalɛɛ tì ɓi nyɔɔnyɔn à rìyalɛ̀n, à yin lɛ à ghɛn kìlɔ̀ŋ ki Bɛ̀ll. "
JHN.3.4,Fɔɔnnɛ Nikodɛm à tɔkà nyi lɛ: Lannɛ mum à rì lɛ à yalɛ̀ntì di à ti ǹsɛ̀ɛ̀mɛn? À rì nya lɛ à sugtì ɓi ɗùm ɗi jɛɛ à yalɛ̀ntì? 
JHN.3.5,"Yeesus à ɓàg nyi lɛ: Ǹkpaa wɔ̀ kɔɔ̀kɔɔ̀ à rìkpaa lɛ, i mum à yalɛɛ ɓi ri mɛ̀nig rì Ǹghay, à yin lɛ à ɗiŋì ɓi kìlɔ̀ŋ ki Bɛ̀ll. "
JHN.3.6,"Lɛ ŋwaànɛ à yalɛɛ rì mɛ̀mùù, à rì lɔŋ mum à mɛ̀mùù, roànɛ à yalɛɛ rì Ǹghay à rì ǹghay. "
JHN.3.7,"Fɔɔnnɛ kɔ̀ɔ kuurag lɛ màa kpaa wɔ̀ lɛ, ki ghɛɛ̀sɛɛ lɛ ɓi ɓiìti kì yalɛɛ. "
JHN.3.8,"Bɛ̀ɓ ì ti ì fɛɓsag jàŋ inɛ ì kɔni, wɔ̀ɔ̀ wowòg lɔŋ lɛ rìfiŋfìŋ kɔ̀ɔ yi fennɛ ì pɛ̀sɛɛ yì, nsoò jàŋ inɛ yɛɛ̀ kɛ̀nkɛ̀n. Fɔlɔɔ nnɛ mum ǹcèm ànɛ à mɛ yalɛn ri Ǹghay à rì. "
JHN.3.9,Nni Nikodɛm à pɛ̀ɛ̀zìghà nyi lɛ: Kìɓan kiǹ ki ri lɛ ki kilɛ̀n di ki ɓaɓaa là? 
JHN.3.10,"Yeesus à kpaa nyi lɛ: Wɔ̀ lɔŋ nɗèsàg ànɛ a Isirayɛl, kɔ̀ɔ ki yi ɓiɓan ɓi? "
JHN.3.11,"Ǹkpaa wɔ̀ kɔɔ̀kɔɔ̀ à rìkpaa lɛ, ɓìsiì kpaakpaa ɓiɓan ɓi tì yii, tì ki tɛɛtɛɛ̀zì ɓum ɓìɓan ɓi tì ghɛngà, kìɓan kifog kɛ̀ ɓi kɔ̀n lɛ di ɓyàa teri rìrèsì ɗis. "
JHN.3.12,"I ɓì ti kɛ̀ ɓi gherɛn di ǹkpaa mìni ɓìɓan ɓi ɓi ziinɛ, lannɛ ɓì rì min ɓiì gherɛɛ di ǹkpaa mìni ɓìɓan ɓi aɗyòò? "
JHN.3.13,Ŋwaàdɛŋ à ka ɓɔkà ɓi aɗyòò i ki cee ɓi lɛ Man à mum ànɛ à sɛngày aɗyòò.
JHN.3.14,"Fɛlɛ yɛ̀ɛ Moyis à pɛ̀sìghà nyoo ɓi kìgeŋ aɗyoo ɓi-reɓ, fɔlɔɔ nnɛ ki ghɛɛ̀sɛɛ girig lɛ, ɓɛɛ pɛsi Man à mum aɗyoo, "
JHN.3.15,"lɛ di mum ǹcèm ànɛ à gherɛɛ nyi, à ɓa rì cɛɓ ki fiɗyàɓ fikɔ̀ɔ̀. "
JHN.3.16,"Lɛ Bɛ̀ll à keesìghà ziinɛ à pyàŋdàg fɔlɔɔ nnɛ à faghà m̀bobog wìì a Man lɛ ŋwaànɛ à gherɛɛ nyi kɛ̀ɛ wu, a ɓa lɔŋ ri cɛɓ ki fiɗyàɓ fikɔ̀ɔ̀. "
JHN.3.17,"Lɛ Bɛ̀ll à romgày ɓi Man wiì ɓi ziinɛ lɛ a fa yɔ̀ bɛ̀lɛn, à romgày lɔŋ nyi lɛ a ghɛɓsi yɔ̀. "
JHN.3.18,"Ŋwaànɛ à gherɛɛ nyi à yiìdi ri bɛ̀lɛn wɔ̀lɛ roànɛ à gherɛɛ ɓi nyi yɛɛ ti rì bɛ̀lɛn ɓisuulɛ, à gherɛ̀ngà ɓi mbobog à Man à Bɛ̀ll. "
JHN.3.19,"Bɛ̀lɛn i rì ǹto lɛ: Kìtɛɛtɛn ki yughày ɓi ziinɛ, ɓum ɓɛ ki keesi birìm à cee kìtɛɛtɛn kìn, lɛ mɛ̀kìkìì maa mɛ ɓaghà mɛ̀ɓeɓtɛn. "
JHN.3.20,"Lɛ mum ǹcèm ànɛ a kìki kiɓe, à ti à ɓèèzàg kìtɛɛtɛn, kɛ̀ɛ ki yù jàŋ inɛ kìtɛɛtɛn ki ri, lɛ ìris wulɛ ɓìɓan ɓii ɓyɛ̀ kɛɛ̀ ki kpagi dan. "
JHN.3.21,"Wɔ̀lɛ roànɛ à ti à kìlàg ɓìɓan ɓi saaɗ, nnyɛɛ ti à yùlàg jàŋ inɛ kìtɛɛtɛn ki ri, lɛ ɓɛɛ ghɛǹ lɛ tɛntɛ̀ɛ̀n lɛ, a kìki ɓiɓan yɛ̀ɛ kɛɛ̀ kɔ̀ngi Bɛ̀ll."
JHN.3.22,"Ajɛ̀m ìnɛn, Yeesus à kɛ̀ngà rì ɓɛ̀yilàg ɓii ɓi ziì Zyude; à ghagsìghà cààmɛ̀n wɔɔ ri ɓɔ, à ki ɓàaɓaɓtì ɓum. "
JHN.3.23,"Zyaŋ girig à ɓààɓàɓtìghà ɓum a Enɔŋ, jàŋbog rì Salim lɛ mɛ̀nig mɛ ɓaghà wɔɔ lɛɛ̀gwey. Nni ɓum ɓɛ kɛnkɛ̀ngà wɔɔ lɛ a ɓaɓti ɓɔ. "
JHN.3.24,Lɛ ki ɓaghà di ɓɛ ka pig ɓi Zyaŋ ɓi naà-zày.
JHN.3.25,"Nni nyoey yi kpighà lɛ rì ɓɛ̀yilàg ɓɛ Zyaŋ, rì muu Ɓɛ̀yudɛ̀n ɓi kìɓan ki ritɛn, ɓi ɓìsyɔ̀ɔ̀ ɓi righerɛ̀n ɗi Ɓɛ̀yudɛ̀n. "
JHN.3.26,"Fɔɔnnɛ ɓɛ̀yilàg ɓɛ kɛngà yɛ̀ɛ Zyaŋ ɓɛ kpaa nyi lɛ: Raɓì, ŋwaànɛ ɓìi nɗì rì nyi cɛcɛɗ ki Zyuridɛŋ, ànɛ wɔ̀ɔ ntɛɛzsii ɓìsi rìɓa ɗii, à ti girig ɓiì ɓàaɓaɓtì ɓum, fɔɔnnɛ ɓum ɓɛ̀cèm ɓɛɛ̀ sùusuùrɛ̀n a lɔ̀ŋkii. "
JHN.3.27,"Nni Zyaŋ à ɓàkà ɓɔ lɛ: Mum à yin lɛ à ɓa rì com kidɛŋ, ki ki yin ki Bɛ̀ll à faa nyi. "
JHN.3.28,"Mìniìɓɔmiɗ ɓì rì mɛ̀ ɓɛ̀wusìnɛ̀ɗ lɛ, ǹkpaaghà lɛ, àa mɛ̀ yɛɛ ri Kiris, kìɓan kifog, ɓɛ romgày mɛ̀ lɛ nsyoŋ̀ yì nyi bee. "
JHN.3.29,"Ŋwaànɛ à rì rì giɓ, yɛɛ ri yii giɓ; wɔ̀lɛ rìghan ɗi yii giɓ ɗi ɗi ri wɔɔ ɗi ti ɗi nyaàràg yɛ̀ɛ mɛ̀nɔ̀ɓɔ̀, lɛ jɛ̀ɛ̀ ì yii giɓ inɛ ɗyɛɛ̀ wowòg. Rìkuu ɗi kinyàà ɗiǹ ɗyɛɛ̀ɗi mɛ̀ ǹɗì ǹɗonɛn ri ɗyɔ̀. "
JHN.3.30,"Ki ghɛɛ̀sɛɛ lɛ nyii ɓɔɓɔg, mɛ̀ nsisìlì. "
JHN.3.31,"Ŋwaànɛ à pɛ̀sɛɛ yì aɗyoo, à teŋmɛɛ à cee ɓum ɓɛ̀cèm; roànɛ à pɛ̀sɛɛ yì ɓi ziinɛ, à rì lɔŋ ŋwaànɛ ɓi ziinɛ, fɔɔnnɛ a ki kpaakpaa ɓiɓan ɓi ɓi ziinɛ. Ŋwaànɛ à pɛ̀sɛɛ yì a ɗyoo, "
JHN.3.32,ɓìɓan ɓi à ghɛngà rì ɓi à wokà ɓyɛɛ̀ɓi a rèrèsì; nni mum à ki teri ɓi rirèsì ɗii ɗiǹ. 
JHN.3.33,"I mum à ki teri rìrèsì ɗii, di à gherɛɛ yɛɛ lɔɔ lɛ Bɛ̀ll à ti à kpaaghì saaɗ. "
JHN.3.34,"Ɓisuulɛ, roànɛ Bɛ̀ll à romgày, a kakali ɓiɓan ɓi Bɛ̀ll; lɛ Bɛ̀ll à ti à roòzàg nyi rì Nghay wìì lɛ pisa. "
JHN.3.35,"Seŋi à keesii Man, fɔɔnnɛ à faghà ɓìɓan ɓìcèm ɓi ɓyàg ɓii. "
JHN.3.36,"Nni mum ǹcèm ànɛ à gherɛɛ Man, à rì rì cɛɓ ki fiɗyàɓ fikɔ̀ɔ̀; ŋwaànɛ à woogh ɓi nyi, àa ghɛn ɓi cɛɓ, kìɓan kifog, rìbaŋì ɗi Bɛ̀ll ɗi kaka nyi ɓi nyòò."
JHN.4.1,"Yeesus à wokà lɛ ɓɛ nkalii Ɓɛ̀fàrìzyɛŋ lɛ nyiì syòŋsyoŋ ɓum à cee Zyaŋ lɛ ɓɛɛ ɓa ɓɛ̀yilàg ɓii, à ki ɓàaɓaɓtì ɓɔ; "
JHN.4.2,"wɔ̀lɛ ɓi saaɗ à rìkpaa, Yeesus nyimiɗ a ɓààɓàɓtìghà ɓi ɓum, lɔŋ ɓɛ̀yilàg ɓii ɓɛɛ ɓààɓàɓtìghà ɓɔ. "
JHN.4.3,Fɔɔnnɛ à pɛ̀sɛ̀ngà a Zyude à sugtì a Galile.
JHN.4.4,"Ki ghɛɛ̀sɛ̀ngà lɛ, a fyeè a Samari. "
JHN.4.5,"Nni à kpagà ɓi bàn ìdɛŋ ìnɛ a Samari ɗii lɛ Sikar, jàŋbog rì dɛm inɛ Yakɔɓ à faghà man wiì ànɛ lɛ Yoosɛɓ. "
JHN.4.6,"Kìɗig ki Yakɔɓ ki ɓaghà ɓi dɛm inɛ̀n; Yeesus à kɔ̀rìghà ɓi nwɔŋì wu kiɗig kiǹ, di à mɛ fɔy rikɛ̀ɛ̀; ki ghɛɛ̀sɛ̀ngà kì ɓaà nunùg toroɓ."
JHN.4.7,"Fɔɔnnɛ giɓ anɛ a Samari à yùghà kì roògh mɛ̀nig, Yeesus à kpaa nyi lɛ: Faa mɛ̀ mɛ̀nig mɛ nɔyɛn. "
JHN.4.8,Lɛ ɓɛ̀yilàg ɓii ɓɛ kɛngà kì làghiì ɓìɗilàg ɓi bàn. 
JHN.4.9,"Nni giɓ anɛ a Samari ànɛn à ɓàkà nyi lɛ: Lannɛ wɔ̀ muu Ɓɛ̀yudɛ̀n, ù lɔni mɛ̀ mɛ̀nig mɛ nɔyɛn, kɔm̀ lɛ mɛ̀ ǹɗì giɓ anɛ a Samari? Lɛ Ɓɛ̀yudɛ̀n ɓɛ ɓaghà ɓi lɛ ɓɛ wooghrɛ̀n ɗì ɓumɓɛ a Samari. "
JHN.4.10,"Fɔɔnnɛ Yeesus à ɓàkà giɓ anɛ̀n lɛ: I wàa yii rìfa ɗi Bɛ̀ll, ù ki yi roànɛ à lɔni wɔ̀ mɛ̀nig mɛ nɔyɛn, di wɔ̀ yaa rì lɛ, ù lɔn nyi mɛ̀nig mɛ noyɛn, di àa ki faa wɔ̀ mɛ̀nig mɛ cɛɓ. "
JHN.4.11,"Nni giɓ anɛ̀n à kpaaghà nyi lɛ: Kan, wɛ̀ɛnɛ̀n kɛ̀ɛ̀ com ki lɛ ù rog mɛ̀nig miì, kìɗig ki ki rì kìrimɛn, nni mɛ̀nig mɛ cɛɓ mɛ ri wɔ̀ ɓiì ɓaà yì fe? "
JHN.4.12,"U fèfeg lɛ wɔ̀ yɛɛ cee seŋi wìs a ǹsɛ̀ɛ̀ anɛ lɛ Yakɔɓ, ànɛ à faghà ɓìsi kìɗig ki, nyimiɗ, rì ɓɔn ɓii, rì ɓìtuwe ɓii, ɓɛ nɔ girig kɔ̀? "
JHN.4.13,"Yeesus à ɓàg nyi lɛ: Mum ǹcèm ànɛ à nɔɔ mɛ̀nig mɛ, à rì ti lɔŋ ɓiì woògh kìnɔli. "
JHN.4.14,"Kìɓan kifog, ŋwaànɛ à rì ɓiì nɔɔ̀ mɛ̀nig mɛ ǹɗì nyi ɓiì faà, àa wogtii gɛ ɓi kinɔli. Lɛ mɛ̀nig mɛ ǹɗì nyi ɓiì faà mɛǹ, mɛ ri ɓiì ghalì ǹsim à cɛɓ ki fiɗyàɓ fikɔ̀ɔ̀ ɓi nɗem wii. "
JHN.4.15,"Nni giɓ anɛ̀n à kpaaghà nyi lɛ: Kan, faa mɛ̀ mɛ̀nig mɛǹ, di kìnɔli kɛ̀ kɛɛ̀ kìti mɛ, kɛ̀ɛ nki yùti kiroògh mɛ̀nig fɛ. "
JHN.4.16,"Yeesus à pɛ̀ɛ̀zì nyi lɛ: Kɛ̀nay kìreŋii yii wɔɔ̀, di u sugtiì fɛ. "
JHN.4.17,Nni giɓ a ɓàkà nyi lɛ: Mɛ̀ ǹ-yin ɗi yii. Yeesus à kpaa nyi lɛ ù kpaa saaɗ yɔɔ̀ kalii lɛ ù yin ɗi yii; 
JHN.4.18,"ɓisuulɛ, ù ti mɛ̀wɛy mɛtaǹ, nni ŋwaànɛ ù rì rì nyi ɓigomìnɛ, à yin yii wɔɔ̀, fɔɔnnɛ jɛ̀ɛ̀ ìnɛ wàa kpaa ì rì miì. "
JHN.4.19,"Nni giɓ a kpaaghà nyi lɛ: Kan! Ǹghɛɛ lɛ, ù rì ǹkpaŋzì-ɓìɓan. "
JHN.4.20,"Ɓɛ̀seŋi ɓis ɓɛ mɓɔgsaagh Bɛ̀ll ɓi dòn ìnɛ, kìɓan kifog mìnii kpaaghì lɛ, a Yorisalɛm nnɛ ɓum ɓɛ ghɛɛ̀sɛɛ kì ɓɔgsaagh Bɛ̀ll. "
JHN.4.21,"Fɔɔnnɛ Yeesus à kpaaghà nyi lɛ: Giɓ anɛ! Gherɛn rìkpaa ɗyɛ̀m, lɛ cààmɛ̀n ki riì, ki ɓyàa ɓɔgsi ti ɓi Tààta ɓi dòn ìnɛ, nsoò lɛ a Yorisalɛm. "
JHN.4.22,"Lɛ mìniì ɓɔɔɓɔgsì com ki ɓì yii ɓi, ɓìsiì ɓɔɔɓɔgsì com ki tì yii, lɛ gòri ì ɓum ì pɛ̀sɛɛ yì a Ɓɛ̀yudɛ̀n. "
JHN.4.23,"Wɔ̀lɛ cààmɛ̀n ki tiì, kiŋcèm ki mɛ ki kpaŋ, ki ɓɛ̀kɔɔ̀kɔɔ̀ ɓɛ ɓɛ̀ɓɔgsì Bɛ̀ll ɓɛ ri ɓiì ɓɔgsii Tààta rì nghay, rì saaɗ. Ɓumɓɛ ɓɛɛ̀ ɓɔɔ̀ɓɔ̀gsì nyi fɔlɔɔ ɓɛɛ̀ɓɛ Tààta a kaakàà. "
JHN.4.24,"Bɛ̀ll àrì Nghay, fɔɔnnɛ ki ghɛɛ̀sɛɛ lɛ ɓumɓɛ ɓɛɛ̀ ɓɔɔɓɔgsì nyi ɓɛɛ ɓɔgsi nyi rì nghay, rì saaɗ. "
JHN.4.25,"Fɔɔnnɛ giɓ anɛ̀n à kpaaghà Yeesus lɛ: Ǹ-yii lɛ Mèsii à ɓiì yùu, ànɛ à rì ɗii lɛ Kiris. Yɛ̀ɛ à ri yù, à ri kali ɓisi ɓiɓan ɓìcèm. "
JHN.4.26,"Yeesus à kpaa min nyi lɛ: Mɛ̀ ànɛ ntòtog anɛ rì wɔ̀, mɛ̀ yɛɛ ri Mèsii."
JHN.4.27,"Ɓi cààmɛ̀n kiǹ innɛ ɓɛ̀yilàg ɓɛ Yeesus ɓɛ sugtìghày, ɓɛ kuuràg yɛ̀ɛ ɓɛ ghɛngà nyi di a tòtog ri giɓ, kìɓan kifog, kìbog ki ɓi ɓɔ ki ghɛɛsìghà ɓi lɛ, kɛɛ tɔg nyi lɛ, la yɛɛ ri? Nsoò lɛ cɛ kɛɛ̀ki u kpaakpaa ri giɓ anɛ? "
JHN.4.28,"Nni giɓ a càɗkà bèè yiì ì mɛ̀nig, à sugtì ɓi bàn, à kpaa ɓumɓɛ wɔɔ lɛ: "
JHN.4.29,"Yùuna kìghɛɛ̀ ŋwaàdɛŋ ànɛ àa kpaa mɛ̀ ɓìɓan ɓìcèm ɓi m̀mɛ kì, ɓaà yi ɓi nnyɛɛ ri Kiris. "
JHN.4.30,"Fɔɔnnɛ ɓum ɓɛ pɛsɛ̀ngày ɓi bàn, ɓɛ yu jàŋ inɛ Yeesus à ɓaghà."
JHN.4.31,"Ɓi nyìinyìm ànɛn, ɓɛ̀yilàg ɓii ɓɛ ɓɔɔ̀ɓɔ̀ŋzìghà nyi, di ɓɛɛ̀ kpaakpaa lɛ: Raɓì, ɗiya ɓà maa com. "
JHN.4.32,"Kìɓan kifog Yeesus à ɓàkà ɓɔ lɛ: Ǹɗì rì ɓìɗilàg ɓidɛŋ ɓi nɗi, ɓi mìnii yii ɓì. "
JHN.4.33,"Fɔɔnnɛ ɓɛ̀yilàg ɓɛ tɔɔ̀ghtɔ̀ɔ̀ghrɛ̀ngà wɔɔ ɓɔ rì ɓɔ lɛ: Ŋwaàdɛŋ àa rì nya lɛ, à yùy nyi rì com ki ɗiyɛn giǹ? "
JHN.4.34,"Yeesus à kpaa ɓɔ lɛ: Ɓìɗilàg ɓyɛm̀ ɓi ri lɛ nki rìkɔ̀n ɗi roànɛ à romgày mɛ̀, ǹki lègsi kisay ki à faghà mɛ̀. "
JHN.4.35,"Mìnii ti ɓì kpaaghì lɛ ɓɛ̀ŋwii ɓaa rɔ̀ɓ ɓɛnin lɛ mɛ̀saŋ mɛɛ tumɛn. Nni mɛ̀ ǹkpaa mìni lɛ, pìighna mis ɓi ghɛǹ yɛ̀ɛ ɓyom ɓyaa tèɗ ɓi ɓɛ̀dɛm lɛ, ɓɛɛ saŋ. "
JHN.4.36,"Ǹsaŋì-mɛ̀saŋ à mɛ teɗ mɛlèɓ mii, à ki taŋzɛn ɓiɗùn ɓisuu cɛɓ ki fiɗyàɓ fikɔ̀ɔ̀, lɛ di m̀ɓɛ̀lì-ɓyom rì ǹsaŋì-mɛ̀saŋ, ɓɛɛ nyaàrɛn ǹɗaŋ. "
JHN.4.37,"Ɓisuulɛ dàɗkì ìnɛ lɛ, i mum bog à ɓɛ̀li, roàmbog à saŋ, ì rì saaɗ. "
JHN.4.38,"Ǹɗomgà mìni lɛ ɓi kɛǹ mɛ̀saŋ ɓi dɛm inɛ ɓum ɓɛdɛŋ ɓɛɛ salà, mìnii ki ɗiŋi ɓi jàŋ inɛ ɓɔɔ mɛ say kɛ̀ɛ̀ mɛ̀tɔɓ."
JHN.4.39,"Ɓumɓɛ a Samari lɛɛ̀gwey ɓɛ ɓi bàn ìnɛn, ɓɛ gherɛ̀ngà Yeesus, ɓi rìkpaa ɗi giɓ anɛ̀n à kpaaghà ɓɔ lɛ: Ŋwaànɛ àa kpaa mɛ̀ ɓìɓan ɓìcèm ɓi m̀mɛ kì. "
JHN.4.40,"Nni yɛ̀ɛ ɓumɓɛ a Samari ɓɛ yughày nyi a nyoo, ɓɛ ɓɔŋzàg nyi lɛ a kɔri a lɔ̀ŋkaa. Fɔɔnnɛ Yeesus à ghagsìghà mɛ̀ru mɛɓɛɛ̀ wɔɔ. "
JHN.4.41,Ɓum ɓɛdɛŋ lɛɛ̀gwey ɓɛ gherɛ̀ngà ɓisuu ɓiɓan ɓi Yeesus nyimiɗ a kpaakpààghà. 
JHN.4.42,"Fɔɔnnɛ ɓɛ kpaaghà giɓ anɛ̀n lɛ, àa rìkpaa ɗyɔɔ ɗyɔ rì ɗyɔ ɗyɛɛ kiì lɛ ti gherɛn. Tì gherɛɛ ɓigomìnɛ lɛ ɓìsiìɓɔmiɗ tì woogh ɓìtòkì ɓii, tì ki yi lɛ, à rì Ǹghɛɓsì-ziinɛ a tààkaà."
JHN.4.43,"Yɛ̀ɛ mɛ̀ru mɛ kiɓɛ̀ɛ̀ mɛǹ mɛ ghaghìghà, nni Yeesus à pɛ̀sɛ̀ngà wɔɔ lɛ a kɛǹ a Galile. "
JHN.4.44,Lɛ nyimiɗ a kalìghà lɛ: Ǹkpaŋzì-ɓìɓan a maà kem ɓi ɓi kìlɔ̀ŋ kii. 
JHN.4.45,"Yɛ̀ɛ à kpagà a Galile, ɓumɓɛ wɔɔ ɓɛ ghaɓ nyi lɛ syeesyee, lɛ ɓɛ ghɛngà ɓìɓan ɓìcèm ɓi à kìghà a Yorisalɛm, ɓi cààmɛ̀n à tìcàɓ ti Paskà, lɛ ɓumɓɛ̀n ɓɛ kɛǹgà girig tìcàɓ tiǹ. "
